{
  "$schema": "https://json-schema.org/draft/2020-12/schema",
  "title": "XeliasAI PPT Goal Spec",
  "type": "object",
  "required": [
    "title",
    "goal"
  ],
  "additionalProperties": true,
  "properties": {
    "title": {
      "type": "string"
    },
    "goal": {
      "type": "string"
    },
    "audience": {
      "type": "string"
    },
    "owner": {
      "type": "string"
    },
    "randomSeed": {
      "type": "string"
    },
    "pageCount": {
      "type": "number"
    },
    "themePack": {
      "type": "string",
      "enum": [
        "theme01",
        "theme02",
        "theme03",
        "theme04",
        "theme05",
        "theme06",
        "theme07",
        "theme08",
        "theme09",
        "theme10",
        "theme11",
        "theme12"
      ]
    },
    "text": {
      "type": "object",
      "additionalProperties": {
        "type": "string"
      }
    },
    "media": false,
    "props": {
      "type": "object"
    },
    "slides": {
      "type": "array",
      "items": {
        "type": "object",
        "required": [
          "layout"
        ],
        "properties": {
          "id": {
            "type": "string"
          },
          "key": {
            "type": "string"
          },
          "slideKey": {
            "type": "string"
          },
          "logicalIndex": {
            "type": "number"
          },
          "layout": {
            "type": "string"
          },
          "props": {
            "type": "object"
          },
          "media": false,
          "copy": {
            "type": "object"
          },
          "needsVisual": {
            "type": "boolean"
          },
          "imageGen": {
            "type": "boolean"
          },
          "needsImageGen": {
            "type": "boolean"
          },
          "plannedImages": {
            "type": [
              "boolean",
              "number"
            ]
          },
          "providedImages": {
            "oneOf": [
              {
                "type": "boolean"
              },
              {
                "type": "array",
                "items": {
                  "type": "string"
                }
              }
            ]
          }
        },
        "additionalProperties": true
      }
    }
  }
}
