{
  "title": "AI 融资年度回顾",
  "goal": "面向投资团队汇报 AI 融资年度进展、关键变化和下一步判断",
  "audience": "投资团队",
  "owner": "研究团队",
  "randomSeed": "theme08-example",
  "pageCount": 5,
  "themePack": "theme08",
  "slides": [
    {
      "layout": "theme08_page001",
      "props": {
        "eyebrow": "示例封面",
        "headlineLine1": "AI 融资年度回顾",
        "headlineHl": "AI 融资年度回顾",
        "subtitle": "面向投资团队汇报 AI 融资年度进展、关键变化和下一步判断",
        "yearTag": "2026",
        "goldenLine": "AI 融资年度回顾",
        "handNote": "投资团队 / 研究团队"
      }
    },
    {
      "layout": "theme08_page006",
      "props": {
        "eyebrow": "示例页面 2",
        "headline": "AI 融资年度回顾 · 2",
        "subheadline": "AI 融资年度回顾",
        "summary": "面向投资团队汇报 AI 融资年度进展、关键变化和下一步判断"
      }
    },
    {
      "layout": "theme08_page018",
      "props": {
        "eyebrow": "示例页面 3",
        "headline": "AI 融资年度回顾 · 3",
        "subheadline": "AI 融资年度回顾",
        "summary": "面向投资团队汇报 AI 融资年度进展、关键变化和下一步判断"
      }
    },
    {
      "layout": "theme08_page030",
      "props": {
        "eyebrow": "示例页面 4",
        "headline": "AI 融资年度回顾 · 4",
        "subheadline": "AI 融资年度回顾",
        "summary": "面向投资团队汇报 AI 融资年度进展、关键变化和下一步判断"
      }
    },
    {
      "layout": "theme08_page074",
      "props": {
        "kicker": "示例页面 5",
        "eyebrow": "示例页面 5",
        "label": "示例页面",
        "source": "XeliasAI PPT example",
        "sealTop": "XELIASAI",
        "sealBottom": "PPT"
      }
    }
  ]
}
